{
  "schema": "h3-context-reconstruction-regression/1",
  "item": "M16-02",
  "version": "1.0.0",
  "updated_at": "2026-08-11",
  "qualification_status": "MANUAL_ONLY_SCOPED",
  "supported_profile_id": "supported-c44-v1",
  "profiles": [
    {
      "profile_id": "supported-c44-v1",
      "route": "v1",
      "disposition": "qualified",
      "claim_ceiling": "structural_native_manual_only",
      "qualified": true,
      "native_required": true,
      "evidence_refs": [
        "governance/contracts/compatibility_matrix_v1.json",
        "tests/test_native_h3_adapter.py"
      ],
      "host_version": "0.30.0",
      "host_revision": "c44dea18809e3ca0e12e25cbe6938c2c45a29c9d",
      "frontend_version": "1.47.12",
      "frontend_revision": "f339c6b2ec0cc90e1c4fa717d9f7d6d565a8f6da",
      "node_api": "V1_ONLY",
      "prompt_socket": "STRING",
      "evidence_kind": "structural_fixture"
    },
    {
      "profile_id": "v3-numbered",
      "route": "v3",
      "disposition": "blocked",
      "claim_ceiling": "no_v3_executable_claim",
      "qualified": false,
      "native_required": true,
      "evidence_refs": [
        "governance/contracts/compatibility_matrix_v1.json",
        "tests/fixtures/m16_01_source_requalification.json"
      ],
      "host_version": "unavailable",
      "host_revision": "unavailable",
      "frontend_version": "1.47.12",
      "frontend_revision": "f339c6b2ec0cc90e1c4fa717d9f7d6d565a8f6da",
      "node_api": "V3_UNPINNED",
      "prompt_socket": "STRING",
      "evidence_kind": "structural_fixture"
    },
    {
      "profile_id": "latest-compatible",
      "route": "latest",
      "disposition": "blocked",
      "claim_ceiling": "no_latest_substitution",
      "qualified": false,
      "native_required": true,
      "evidence_refs": [
        "governance/contracts/compatibility_matrix_v1.json",
        "scripts/m16_01_source_requalification.py"
      ],
      "host_version": "latest-compatible",
      "host_revision": "unavailable",
      "frontend_version": "latest-compatible",
      "frontend_revision": "unavailable",
      "node_api": "UNDECLARED",
      "prompt_socket": "STRING",
      "evidence_kind": "structural_fixture"
    },
    {
      "profile_id": "fixed-h3-generation",
      "route": "h3",
      "disposition": "unavailable",
      "claim_ceiling": "no_fixed_h3_generation_claim",
      "qualified": false,
      "native_required": true,
      "evidence_refs": [
        "governance/contracts/fixed_h3_generation_v1.schema.json",
        "tests/fixtures/m14_05_fixed_h3_generation.json"
      ],
      "host_version": "0.30.0",
      "host_revision": "c44dea18809e3ca0e12e25cbe6938c2c45a29c9d",
      "frontend_version": "1.47.12",
      "frontend_revision": "f339c6b2ec0cc90e1c4fa717d9f7d6d565a8f6da",
      "node_api": "V1_ONLY",
      "prompt_socket": "STRING",
      "evidence_kind": "generation_disposition"
    },
    {
      "profile_id": "official-oracle",
      "route": "oracle",
      "disposition": "unavailable",
      "claim_ceiling": "no_official_oracle_claim",
      "qualified": false,
      "native_required": false,
      "evidence_refs": [
        "tests/test_comparative_evaluation.py"
      ],
      "host_version": "unavailable",
      "host_revision": "unavailable",
      "frontend_version": "unavailable",
      "frontend_revision": "unavailable",
      "node_api": "UNAVAILABLE",
      "prompt_socket": "STRING",
      "evidence_kind": "oracle_disposition"
    },
    {
      "profile_id": "ollama-live",
      "route": "ollama",
      "disposition": "unavailable",
      "claim_ceiling": "no_live_ollama_claim",
      "qualified": false,
      "native_required": false,
      "evidence_refs": [
        "comfyui_h3_context/contracts/prompt_model_profiles_v5.json",
        "tests/test_provider_policy.py"
      ],
      "host_version": "unavailable",
      "host_revision": "unavailable",
      "frontend_version": "unavailable",
      "frontend_revision": "unavailable",
      "node_api": "UNAVAILABLE",
      "prompt_socket": "STRING",
      "evidence_kind": "provider_disposition"
    }
  ],
  "criteria": [
    {
      "id": "R3",
      "title": "clean_artifact",
      "status": "PASS",
      "disposition": "manual_only",
      "reason": null,
      "claim_ceiling": "structural_and_declared_matrix_only",
      "evidence_kind": "release_artifact",
      "evidence_refs": [
        "scripts/build_gate_report.py"
      ],
      "execution": {
        "network_contacted": false,
        "provider_enabled": false,
        "model_loaded": false,
        "media_opened": false,
        "host_started": false,
        "native_present": false
      },
      "native_required": false,
      "substitution_allowed": false
    },
    {
      "id": "R4",
      "title": "clean_install",
      "status": "PASS",
      "disposition": "manual_only",
      "reason": null,
      "claim_ceiling": "structural_and_declared_matrix_only",
      "evidence_kind": "release_artifact",
      "evidence_refs": [
        "scripts/release_matrix.py"
      ],
      "execution": {
        "network_contacted": false,
        "provider_enabled": false,
        "model_loaded": false,
        "media_opened": false,
        "host_started": false,
        "native_present": false
      },
      "native_required": false,
      "substitution_allowed": false
    },
    {
      "id": "R5",
      "title": "one_entry_bundle",
      "status": "PASS",
      "disposition": "manual_only",
      "reason": null,
      "claim_ceiling": "structural_and_declared_matrix_only",
      "evidence_kind": "release_artifact",
      "evidence_refs": [
        "scripts/frontend_build_report.py"
      ],
      "execution": {
        "network_contacted": false,
        "provider_enabled": false,
        "model_loaded": false,
        "media_opened": false,
        "host_started": false,
        "native_present": false
      },
      "native_required": false,
      "substitution_allowed": false
    },
    {
      "id": "R6",
      "title": "packaging_migration_rollback",
      "status": "PASS",
      "disposition": "manual_only",
      "reason": null,
      "claim_ceiling": "structural_and_declared_matrix_only",
      "evidence_kind": "release_artifact",
      "evidence_refs": [
        "scripts/release_matrix.py"
      ],
      "execution": {
        "network_contacted": false,
        "provider_enabled": false,
        "model_loaded": false,
        "media_opened": false,
        "host_started": false,
        "native_present": false
      },
      "native_required": false,
      "substitution_allowed": false
    },
    {
      "id": "R8",
      "title": "co_installation",
      "status": "PASS",
      "disposition": "manual_only",
      "reason": null,
      "claim_ceiling": "structural_and_declared_matrix_only",
      "evidence_kind": "release_artifact",
      "evidence_refs": [
        "scripts/release_matrix.py"
      ],
      "execution": {
        "network_contacted": false,
        "provider_enabled": false,
        "model_loaded": false,
        "media_opened": false,
        "host_started": false,
        "native_present": false
      },
      "native_required": false,
      "substitution_allowed": false
    },
    {
      "id": "R9",
      "title": "performance_cancellation",
      "status": "PASS",
      "disposition": "manual_only",
      "reason": null,
      "claim_ceiling": "structural_and_declared_matrix_only",
      "evidence_kind": "host_e2e",
      "evidence_refs": [
        "tests/test_performance_gate.py",
        "tests/test_media_subprocess_hardening.py"
      ],
      "execution": {
        "network_contacted": false,
        "provider_enabled": false,
        "model_loaded": false,
        "media_opened": false,
        "host_started": false,
        "native_present": false
      },
      "native_required": false,
      "substitution_allowed": false
    },
    {
      "id": "R10",
      "title": "offline_extension_provider_absence",
      "status": "PASS",
      "disposition": "manual_only",
      "reason": null,
      "claim_ceiling": "structural_and_declared_matrix_only",
      "evidence_kind": "security_audit",
      "evidence_refs": [
        "scripts/security_audit.py"
      ],
      "execution": {
        "network_contacted": false,
        "provider_enabled": false,
        "model_loaded": false,
        "media_opened": false,
        "host_started": false,
        "native_present": false
      },
      "native_required": false,
      "substitution_allowed": false
    },
    {
      "id": "P1",
      "title": "secret_and_hygiene",
      "status": "PASS",
      "disposition": "manual_only",
      "reason": null,
      "claim_ceiling": "structural_and_declared_matrix_only",
      "evidence_kind": "security_audit",
      "evidence_refs": [
        "scripts/security_audit.py"
      ],
      "execution": {
        "network_contacted": false,
        "provider_enabled": false,
        "model_loaded": false,
        "media_opened": false,
        "host_started": false,
        "native_present": false
      },
      "native_required": false,
      "substitution_allowed": false
    },
    {
      "id": "P2",
      "title": "format_lint_type_unit_build",
      "status": "PASS",
      "disposition": "manual_only",
      "reason": null,
      "claim_ceiling": "structural_and_declared_matrix_only",
      "evidence_kind": "structural_fixture",
      "evidence_refs": [
        "scripts/run_full_tests_windows.ps1",
        "scripts/run_full_tests_linux.sh"
      ],
      "execution": {
        "network_contacted": false,
        "provider_enabled": false,
        "model_loaded": false,
        "media_opened": false,
        "host_started": false,
        "native_present": false
      },
      "native_required": false,
      "substitution_allowed": false
    },
    {
      "id": "P3",
      "title": "pure_core",
      "status": "PASS",
      "disposition": "manual_only",
      "reason": null,